{"campaign_id":"luremandate-transitions-v1","completed_at":"2026-09-06T02:06:40.000Z","engine":{"engine_artifact_sha256":"aaaaaaaaaaaaaaaaaaaaaaaaaaaaaaaaaaaaaaaaaaaaaaaaaaaaaaaaaaaaaaaa","engine_id":"luremandate-reference","engine_version":"1.0.0"},"limitations":["synthetic_metadata_only_no_prompts_commands_payloads_credentials_hosts_urls_or_customer_content","approval_identity_role_timestamp_and_effect_records_are_claims_not_authenticated_facts","impact_units_are_organization_defined_ordinals_not_currency_or_a_safety_measure","results_cover_only_submitted_transactions_and_do_not_establish_complete_runtime_mediation","passing_is_not_compliance_certification_legal_authority_or_deployment_authorization"],"plan_sha256":"4100974d4e92cd367d8de2d91e578ab5fe3edb5f762f9c241ca0bcd8d614c521","privacy":{"customer_content":"excluded","personal_data":"synthetic_identifiers_only","secrets":"excluded","transaction_payloads":"excluded_digest_bound_metadata_only"},"run_id":"mandate-transitions-run-1","schema":"https://github.com/immu4989/lurebench/spec/luremandate-run-v1","schema_version":1,"started_at":"2026-09-05T15:00:00.000Z","transactions":[{"approvals":[{"approval_id":"transition-0001-mission","approver_id":"approver-mission","approver_role":"mission-owner","decision":"approve","expires_at":"2026-09-05T15:01:01.000Z","intent_sha256":"ec3dc100d0d34c260c5dd7fa457933fe302f90d4f11d954e5c71ea20ccbc5477","issued_at":"2026-09-05T15:00:01.000Z","nonce":"transition-0001-mission-nonce"},{"approval_id":"transition-0001-security","approver_id":"approver-security","approver_role":"security-reviewer","decision":"approve","expires_at":"2026-09-05T15:01:01.000Z","intent_sha256":"ec3dc100d0d34c260c5dd7fa457933fe302f90d4f11d954e5c71ea20ccbc5477","issued_at":"2026-09-05T15:00:01.000Z","nonce":"transition-0001-security-nonce"}],"decision":{"decided_at":"2026-09-05T15:00:01.000Z","decision":"block","decision_id":"transition-0001-decision","reason_code":"policy_unknown"},"intent":{"action":"apply-change","agent_id":"agent-a","impact_units":100,"intent_id":"transition-0001-intent","intent_nonce":"transition-0001-intent-nonce","policy_id":"high-impact","proposed_at":"2026-09-05T15:00:01.000Z","requester_id":"transition-01-a","resource_id":"resource-01","run_id":"mandate-transitions-run-1","tenant_id":"agency-tenant","workload_spiffe_id":"spiffe://example.gov/workload/agent-a"},"intent_sha256":"ec3dc100d0d34c260c5dd7fa457933fe302f90d4f11d954e5c71ea20ccbc5477","outcome":{"observed_at":null,"sensor_id":null,"state":"not_attempted"},"sequence":1,"transaction_id":"transition-0001"},{"approvals":[{"approval_id":"transition-0002-mission","approver_id":"approver-mission","approver_role":"mission-owner","decision":"approve","expires_at":"2026-09-05T15:01:02.000Z","intent_sha256":"31dc58f0a0f77c123cdeb9e066de15e5827687b051570901d271b19adfaad858","issued_at":"2026-09-05T15:00:02.000Z","nonce":"transition-0002-mission-nonce"},{"approval_id":"transition-0002-security","approver_id":"approver-security","approver_role":"security-reviewer","decision":"approve","expires_at":"2026-09-05T15:01:02.000Z","intent_sha256":"31dc58f0a0f77c123cdeb9e066de15e5827687b051570901d271b19adfaad858","issued_at":"2026-09-05T15:00:02.000Z","nonce":"transition-0002-security-nonce"}],"decision":{"decided_at":"2026-09-05T15:00:02.000Z","decision":"block","decision_id":"transition-0002-decision","reason_code":"policy_unknown"},"intent":{"action":"apply-change","agent_id":"agent-a","impact_units":51,"intent_id":"transition-0002-intent","intent_nonce":"transition-0002-intent-nonce","policy_id":"high-impact","proposed_at":"2026-09-05T15:00:02.000Z","requester_id":"transition-01-a","resource_id":"resource-01","run_id":"mandate-transitions-run-1","tenant_id":"agency-tenant","workload_spiffe_id":"spiffe://example.gov/workload/agent-a"},"intent_sha256":"31dc58f0a0f77c123cdeb9e066de15e5827687b051570901d271b19adfaad858","outcome":{"observed_at":null,"sensor_id":null,"state":"not_attempted"},"sequence":2,"transaction_id":"transition-0002"},{"approvals":[{"approval_id":"transition-0003-mission","approver_id":"approver-mission","approver_role":"mission-owner","decision":"approve","expires_at":"2026-09-05T15:01:03.000Z","intent_sha256":"648afd160b2a41c4bc77147c64c679989843e439b7e3d98ade4986c963b07128","issued_at":"2026-09-05T15:00:03.000Z","nonce":"transition-0003-mission-nonce"},{"approval_id":"transition-0003-security","approver_id":"approver-security","approver_role":"security-reviewer","decision":"approve","expires_at":"2026-09-05T15:01:03.000Z","intent_sha256":"648afd160b2a41c4bc77147c64c679989843e439b7e3d98ade4986c963b07128","issued_at":"2026-09-05T15:00:03.000Z","nonce":"transition-0003-security-nonce"}],"decision":{"decided_at":"2026-09-05T15:00:03.000Z","decision":"block","decision_id":"transition-0003-decision","reason_code":"policy_unknown"},"intent":{"action":"apply-change","agent_id":"agent-a","impact_units":50,"intent_id":"transition-0003-intent","intent_nonce":"transition-0003-intent-nonce","policy_id":"high-impact","proposed_at":"2026-09-05T15:00:03.000Z","requester_id":"transition-01-a","resource_id":"resource-01","run_id":"mandate-transitions-run-1","tenant_id":"agency-tenant","workload_spiffe_id":"spiffe://example.gov/workload/agent-a"},"intent_sha256":"648afd160b2a41c4bc77147c64c679989843e439b7e3d98ade4986c963b07128","outcome":{"observed_at":null,"sensor_id":null,"state":"not_attempted"},"sequence":3,"transaction_id":"transition-0003"},{"approvals":[{"approval_id":"transition-0004-mission","approver_id":"approver-mission","approver_role":"mission-owner","decision":"approve","expires_at":"2026-09-05T15:01:04.000Z","intent_sha256":"26e217deb1749ace40842e4bcdb61489a33875a66cba35f2e4d8b47e49f39a1f","issued_at":"2026-09-05T15:00:04.000Z","nonce":"transition-0004-mission-nonce"},{"approval_id":"transition-0004-security","approver_id":"approver-security","approver_role":"security-reviewer","decision":"approve","expires_at":"2026-09-05T15:01:04.000Z","intent_sha256":"26e217deb1749ace40842e4bcdb61489a33875a66cba35f2e4d8b47e49f39a1f","issued_at":"2026-09-05T15:00:04.000Z","nonce":"transition-0004-security-nonce"}],"decision":{"decided_at":"2026-09-05T15:00:04.000Z","decision":"block","decision_id":"transition-0004-decision","reason_code":"policy_unknown"},"intent":{"action":"apply-change","agent_id":"agent-a","impact_units":1,"intent_id":"transition-0004-intent","intent_nonce":"transition-0004-intent-nonce","policy_id":"high-impact","proposed_at":"2026-09-05T15:00:04.000Z","requester_id":"transition-01-a","resource_id":"resource-01","run_id":"mandate-transitions-run-1","tenant_id":"agency-tenant","workload_spiffe_id":"spiffe://example.gov/workload/agent-a"},"intent_sha256":"26e217deb1749ace40842e4bcdb61489a33875a66cba35f2e4d8b47e49f39a1f","outcome":{"observed_at":null,"sensor_id":null,"state":"not_attempted"},"sequence":4,"transaction_id":"transition-0004"},{"approvals":[{"approval_id":"transition-0005-mission","approver_id":"approver-mission","approver_role":"mission-owner","decision":"deny","expires_at":"2026-09-05T16:07:41.000Z","intent_sha256":"05979df26db1b8e540f8b0b30992b03a6ef4d49036b9e14baeae2b913c3a4a49","issued_at":"2026-09-05T16:06:41.000Z","nonce":"transition-0005-mission-nonce"},{"approval_id":"transition-0005-security","approver_id":"approver-security","approver_role":"security-reviewer","decision":"approve","expires_at":"2026-09-05T16:07:41.000Z","intent_sha256":"05979df26db1b8e540f8b0b30992b03a6ef4d49036b9e14baeae2b913c3a4a49","issued_at":"2026-09-05T16:06:41.000Z","nonce":"transition-0005-security-nonce"}],"decision":{"decided_at":"2026-09-05T16:06:41.000Z","decision":"block","decision_id":"transition-0005-decision","reason_code":"policy_unknown"},"intent":{"action":"apply-change","agent_id":"agent-a","impact_units":100,"intent_id":"transition-0005-intent","intent_nonce":"transition-0005-intent-nonce","policy_id":"high-impact","proposed_at":"2026-09-05T16:06:41.000Z","requester_id":"transition-02-a","resource_id":"resource-02","run_id":"mandate-transitions-run-1","tenant_id":"agency-tenant","workload_spiffe_id":"spiffe://example.gov/workload/agent-a"},"intent_sha256":"05979df26db1b8e540f8b0b30992b03a6ef4d49036b9e14baeae2b913c3a4a49","outcome":{"observed_at":null,"sensor_id":null,"state":"not_attempted"},"sequence":5,"transaction_id":"transition-0005"},{"approvals":[{"approval_id":"transition-0006-mission","approver_id":"approver-mission","approver_role":"mission-owner","decision":"approve","expires_at":"2026-09-05T16:07:42.000Z","intent_sha256":"5d6a006e4c072b76d7490ad5b8088135457a3f39b3eb3bb9db58b56d8cce73ab","issued_at":"2026-09-05T16:06:42.000Z","nonce":"transition-0006-mission-nonce"},{"approval_id":"transition-0006-security","approver_id":"approver-security","approver_role":"security-reviewer","decision":"approve","expires_at":"2026-09-05T16:07:42.000Z","intent_sha256":"5d6a006e4c072b76d7490ad5b8088135457a3f39b3eb3bb9db58b56d8cce73ab","issued_at":"2026-09-05T16:06:42.000Z","nonce":"transition-0006-security-nonce"}],"decision":{"decided_at":"2026-09-05T16:06:42.000Z","decision":"block","decision_id":"transition-0006-decision","reason_code":"policy_unknown"},"intent":{"action":"apply-change","agent_id":"agent-a","impact_units":100,"intent_id":"transition-0006-intent","intent_nonce":"transition-0006-intent-nonce","policy_id":"high-impact","proposed_at":"2026-09-05T16:06:42.000Z","requester_id":"transition-02-a","resource_id":"resource-02","run_id":"mandate-transitions-run-1","tenant_id":"agency-tenant","workload_spiffe_id":"spiffe://example.gov/workload/agent-a"},"intent_sha256":"5d6a006e4c072b76d7490ad5b8088135457a3f39b3eb3bb9db58b56d8cce73ab","outcome":{"observed_at":null,"sensor_id":null,"state":"not_attempted"},"sequence":6,"transaction_id":"transition-0006"},{"approvals":[{"approval_id":"transition-0007-mission","approver_id":"approver-mission","approver_role":"mission-owner","decision":"approve","expires_at":"2026-09-05T16:07:43.000Z","intent_sha256":"fa16343a7